query,variant_id,variant,chunking_method,similarity,chunk_index,chunk_text,rank
beginner technical seo,main_site__html,main_site,html,0.788,18,An Introduction to Technical SEO An Introduction to Technical SEO An Introduction to Technical SEO An Introduction to Technical SEO An Introduction to Technical SEO,1
beginner technical seo,comparison_site_1__html,comparison_site_1,html,0.762,23,"Site architecture, which streamlines site navigation for search engines, plus provides context on the importance of different URLs. Site architecture also helps users understand your site — and how to find what they need. Internal linking, which helps search engines (and users) discover your site’s content and understand that content’s purpose. Good internal linking can take shape through navigational and body copy links. Best technical SEO tools for beginners",2
beginner technical seo,comparison_site_1__html,comparison_site_1,html,0.761,60,What is Technical SEO? Why is Technical SEO Important? What Are the Most Important Technical SEO Factors? Best Technical SEO Tools for Beginners 10 Important Technical SEO Best Practices 1. Improve Your Page Speed 2. Submit Sitemaps 3. Optimize Your Robots.txt File 4. Optimize Your Website Architecture for SEO 5. Ensure Your Website is Secure 6. Make Sure Your Website is Accessible 7. Use Schema Markup 8. Add Internal Links,3
beginner technical seo,comparison_site_1__html,comparison_site_1,html,0.757,4,"Technical SEO Basics: Your Complete Beginner’s GuideTechnical SEO encompasses page speed, sitemaps, robots.txt, website architecture, schema markup, and more. Learn how to master these elements in this guide to technical SEO basics.Written byWebFX Marketing ExpertsLast UpdatedMarch 20, 2025What is technical SEO?Technical SEO is the process of optimizing the more technical aspects of your website for better rankings in the search engine results pages (SERPs). It can involve changes like increasing page speed, optimizing for better crawlability and indexing, and more.When it comes tosearch engine optimization (SEO), there are multiple types you should be aware of, one of which is technical SEO.On this page, we’re diving into technical SEO basics you should know, including what it is and the technical SEO elements you should watch out for.Let’s get started!Guide to technical SEO overviewWhat is technical SEO?Why is technical SEO important?10 important technical SEO to watchWhat is technical SEO?Technical SEO is the process of optimizing the more technical elements of your website for search engines to achieve higher rankings in the search results. It can involve optimizations like improving your page load speed, optimizing your site’s crawlability and indexing, submitting your sitemap to Google, implementing schema markup, and more.Why is technical SEO important?Technical SEO is essential because it can greatly impact your website’s performance in search engines.Search engines aim to give their users the best possible experience, which involves showing them websites that the search engine knows and trusts to meet their technical requirements, like being mobile-friendly, secure, and loads quickly.If your site doesn’t meet the technical requirements of search engines, the search engine may not even know your page exists, or it won’t believe that your website offers a good experience for users.If this happens, your site won’t rank in the search results, and users won’t be able to discover your website. That means less web traffic, leads, and sales for your business.That’s why it’s critical to follow technical SEO best practices and optimize for this type of SEO usingtechnical SEO toolsto meet search engine requirements.What are the most important technical SEO factors?The most important technical SEO factors include:Crawling, which is foundational to search engine optimization. If search engines can’t crawl your site, they can’t index it, and if they can’t index it, they can’t serve it in search results.Indexing, which is another critical piece to the SEO puzzle. Search engine crawlers need permission to index your website content — if your URL includes anoindexcommand, search engines won’t add it to their index or search library.Site architecture, which streamlines site navigation for search engines, plus provides context on the importance of different URLs. Site architecture also helps users understand your site — and how to find what they need.Internal linking, which helps search engines (and users) discover your site’s content and understand that content’s purpose. Good internal linking can take shape through navigational and body copy links.Best technical SEO tools for beginnersYou need a toolkit to power your technical SEO optimizations. With a technical SEO toolkit, you can analyze, troubleshoot, and measure — and often for free withtechnical SEO toolslike:ToolPriceUse casesSEO CheckerFreePerform an audit of your site’s current SEO performanceGet custom recommendations for improving rankings and trafficIdentify and fix issues that impact your website’s search rankingsGoogle Search ConsoleFreeSubmit URLs for crawling and indexingValidate crawlability and indexability for GoogleMonitor crawling, indexing, and schema issuesTrack Google Search performance, from impressions to clicksBing Webmaster ToolsFreeValidate crawlability and indexability for BingMonitor crawling, indexing, and performance issuesTrack performance in Bing search resultsScreaming FrogFreeAudit technical issues, like broken links and redirect chainsAnalyze robots.txt commandsGenerate XML sitemapsIntegrate AI for AI-powered SEO optimizationsDon’t fail your website’smost important testGet an SEO scorecard of your website for free in less than 30 seconds.Get Free Report10 important technical SEO best practicesSo, you now know what technical SEO is and why it’s important, but what about how to do it? What technical elements should you optimize on your site for better rankings?Here are 10 important technical SEO best practices to follow!Improve your page speedSubmit sitemapsOptimize your robots.txt fileOptimize your website architecture for SEOEnsure your website is secureMake sure your website is accessibleUse schema markupAdd internal linksFix broken pagesOptimize for mobile users1. Improve your page speedFirst things first, your website should be fast. Very fast. In fact, your pages should load in about two seconds.Why?Both search engines and users like fast websites.If a user visits your site and it takes too long to load, they’ll leave and choose a competitor. A slow-loading website gives users a bad experience when your images or content fail to load, leaving them without the info they need. In other words, a slow-loading website hurts your rankings and traffic.Plus,search engine spidersneed to crawl your website so that search engines can discover it and index it for use in future search results. Believe it or not, search engine spiders don’t have all day to crawl your site.If your pages load slowly, they may not be able to crawl the entirety of your site, leaving some of your pages invisible to search engines.2. Submit sitemapsYou should also ensure you have a sitemap for your website.Asitemapis basically a roadmap that lists all the pages of your website. It makes it easy for search engines to learn about every page on your site.Simply put, when you have a sitemap, search engines can easily index all your URLs, ensuring that all of your pages are candidates for higher rankings in the SERPs.There are two types of sitemaps — HTML and XML. You’ll only need to submit anXML sitemapto Google.And it’s easy to submit your sitemap to search engines like Google.Simply head over to Google Search Console and click onSitemapsfrom the menu on the left-hand side.Enter the URL of your sitemap and then clickSubmit.It’s important to regularly submit sitemaps as you add new pages to your site or update your pages so that search engines always have an up-to-date roadmap of your pages.3. Optimize your robots.txt fileWe mentioned before that search engines must be able to crawl and index your website. Otherwise, they won’t know your pages exist and, therefore, won’t rank them in the SERPs.This is where arobots.txt filecomes in.A Robots.txt file is a plain text file in your site’s root directory that is responsible for managing traffic from bots and preventing your website from being overrun with requests.It helps you tell search engine crawlers how you want them to crawl your website. For example, you can tell Google not to crawl pages like shopping carts or directories.While these files are handy, they are seriously tricky, and it’s easy to make a mistake. If you do, you could block search engines from crawling your entire website altogether, and that’s definitely not good.It’s important to optimize your robots.txt file because it can have a huge impact on your search engine rankings. If you’re new to robots.txt files, we recommend reaching out to a technical SEO expert, like SEO.com, to ensure your robots.txt file is in tip-top shape.4. Optimize your website architecture for SEOFourth on our list of important technical SEO elements is yourwebsite architecture.The architecture, or structure, of your website, needs to be optimized for both search engines and users.Your site structure determines how users will navigate your website. It should be easy for them to find the information they need and seamlessly navigate from one page on your site to the next.A logical site structure gives users a positive experience on your site, which is acrucial ranking factor.Plus, search engine spiders crawl your website by passing between links on your pages. That means your site architecture plays a large role in how search engines crawl and index your site.It’s important to ensure that your website includes:A logical site hierarchyMatching URL structuresBreadcrumbsInternal links5. Ensure your website is secureNo guide to technical SEO basics would be complete without mentioningwebsite security. Security is a major technical SEO element you won’t want to ignore.If your website isn’t safe for users, search engines may not index your site, no matter how helpful your content is, because it’s not safe for users and doesn’t promote a positive user experience.Plus, users won’t want to interact with or shop on a site that’s not secure, because their information could be compromised.One of the best ways to make your site secure is to implement HTTPs. HTTPs ensures that no one can intercept data that’s sent between a user’s browser and your website. For example, if someone buys something with their credit card on your site, their card details will be safe from potential hackers.To implement HTTPs, you’ll need anSSL certificate. To obtain an SSL certificate, you’ll need to choose a Certificate Authority (CA).Some popular CAs are:GeoTrustRapidSSLComodo SSLGlobalSign6. Make sure your website is accessibleWebsite accessibilityrefers to focusing on making your website accessible to everyone, including people with impairments or disabilities.When you make your website accessible, you ensure every user has a great experience on your website. If your website isn’t accessible, search engines may not index your site in the first place, even if you have high-quality, valuable content.There are a few ways you can make your website more accessible, including:Addalt textto audio and videoWrite transcripts for audio- and video-only content and link to those transcripts near that content to make it easy for users to findAdd captions to add videos with soundApply clear labels to formsUse headings and subheadings to divide your content and make it easy to digestEnable navigation control on your website with keyboards, like using the up and down arrows to scroll on your websiteWrite unique and descriptive titles for each page on your site7. Use schema markupSchema markup, or structured data, helps search engines better crawl and understand the content on your website. It’s coding that allows you to create enhanced descriptions that appear in the search results.Google provides asearch galleryof pages that would benefit the most from schema markup. You can add it to your:Product pagesContact pagesGuidesStep-by-step articlesPages that answer a direct questionPages that explain how to complete or accomplish somethingAnd moreFor example, let’s say you have a page that answers the question, “What does an HVAC technician do?” In this case, you can add FAQ markup to the page. ThisHVAC SEO strategycan help your answer appear in the search results and help search engines understand that your page answers this question.You can use a tool likeSchema Markup Generatorto easily add structured data to your page. Just select the type of schema markup you want to create, fill in the fields, and copy and paste the code to your page.8. Add internal linksAnother important technical SEO element to implement isinternal links.We mentioned before that search engine spiders crawl your website by passing through the links on your pages.If your pages don’t link to the other pages on your site, it will be difficult for search engines to crawl and index your pages.That’s why it’s important to have an effective internal linking strategy in place.You should ensure that all your pages contain links to other relevant pages on your site. For example, when writing a blog post, you can link to relevant pages when you mention a particular topic or a product or service you offer.You can also add a section on your pages that contains links to other related blog posts or articles on your site that readers may find interesting.9. Fix broken pagesBroken pagesgive users a bad experience because the content they’re searching for isn’t available.It’s important to ensure that you regularly find and fix any broken links on your website.There are lots of ways you can easily find broken links on your site. One of the easiest ways is to use a tool likeScreaming Frog.Simply enter the URL of your website and wait for Screaming Frog to crawl all your URLs. Once the crawl is finished, look through the report, navigate toResponse Codes,and then clickClient Error 4xx.This report will show you all the broken links currently on your site. Once you’ve identified these links, either redirect them, update them, or remove them completely.10. Optimize for mobile usersMobile users need to have a good experience on your website, too. Search engines want to show their mobile users websites that will look and function correctly so they can get the information they need.If your website isn’t mobile-friendly, you’ll miss out on tons of rankings and traffic.If you’re not sure if your site is mobile-friendly, useGoogle’s Mobile-Friendly Test toolto easily check:The best way to ensure your website is optimized for mobile users is to implement responsive design. Responsive design ensures that your site will display well on smaller screens and that all your functions, like buttons and shopping carts, will work on mobile devices.Learn more technical SEO basics on SEO.comWe hope you liked this guide to technical SEO! If you want to learn more technical SEO basics, you can find everything you need to implement a successful SEO strategy bybrowsing the content on our blog!And if you want professional help, check out ourtechnical SEO servicesorcontact us onlinetoday to learn more.Let’s Drive ResultsTogetherGet SEO ProposalTable of ContentsWhat is Technical SEO?Why is Technical SEO Important?What Are the Most Important Technical SEO Factors?Best Technical SEO Tools for Beginners10 Important Technical SEO Best Practices1. Improve Your Page Speed2. Submit Sitemaps3. Optimize Your Robots.txt File4. Optimize Your Website Architecture for SEO5. Ensure Your Website is Secure6. Make Sure Your Website is Accessible7. Use Schema Markup8. Add Internal Links9. Fix Broken Pages10. Optimize for Mobile UsersLearn More Technical SEO Basics on SEO.comLet’s Drive ResultsTogetherGet SEO ProposalWritersAbby FieldsSEO SpecialistEmily Carter, M.S.Sr. Content Team LeadDive DeeperTechnical SEO9 Website Accessibility Best Practices You Can EmulateWebsite Architecture & SEO: How to Create an SEO-First SiteWhat Are Sitemaps (And Why Use Sitemaps for SEO)?What is Page Speed? Learn the Basics from SEO ExpertsWhat is Schema Markup? + How to Implement It for SEOWhat is Website Security and How Can You Optimize for It?SEO AnalyticsSEO AnalyticsWhat Are SEO KPIs? +5 SEO Metrics to TrackWhat is Your SEO’s ROI? Learn How to Calculate Yours NowHow Search Engines WorkHow Search Engines WorkSEO Ranking Factors in 2025: a Look Inside Google’s Search AlgorithmSGE Ranking Factors: Inside Google’s AI OverviewsWebsite Crawling 101: the Beginner’s Guide to Web CrawlersOff-Page SEOHow Your Company Can Harness Site Listings for SEOOff-Page SEO BasicsSEO Link Building Basics for Your BusinessOn-Page SEOOn-Page SEO BasicsSEO Title Tags: What Are They? [+ 5 Tips to Optimize Yours]The Ultimate SEO Keyword Research Guide in 2025SEO Content10 SEO Best Practices for Images to Boost Your Rankings10 SEO Tips for Blogs to Boost Your Rankings (+ Examples)6 SEO Best Practices for Product Pages to Conquer SERPSSEO Content GuideSEO GlossarySEO GlossaryWhat is Artificial Intelligence? 3 Key Uses for AI in SEOWhat is E-E-A-T and Why is It Important for SEO?What is SEO? Learn the Essentials of Search Engine OptimizationRecommended ReadingCan You Do SEO Yourself? A DIY SEO Guide for BeginnersLearn about the pros and cons of DIY SEO, including cost savings and control, but also the lack of expertise and time commitment, and discover beginner-friendly steps to optimize your website yourself.Read NowRecommended Reading15 SEO Benefits That Get Websites to Start Doing SEOWhether you’re debating about doing SEO or preparing a proposal for your leadership team, these SEO benefits will provide the information you need.Read NowDownload our free marketing guidesBecause we know how tough marketing can get, we’ve created this handy guide for you based on our 25++ years of experience in the industry.SEOSEO Ranking Factors in 2025Unlock the secrets to dominating search engine results in 2025 with our exclusive PDF guide!DownloadPopularSEOSEO ChecklistStart improving your site’s SEO with this beginner’s checklist!DownloadPopularRFPSEO RFP TemplateDownload this easy-to-use template to start your search for an SEO agency.DownloadMarketing Guides FormDownload YourFree GuideEnter your name and email to download your free guide. We will also send the download link to your inbox.Your name(Required)Your email address(Required)Subscribe to our weekly newsletterSubscribe to our weekly newsletterNameThis field is for validation purposes and should be left unchanged.Let’s Drive ResultsTogetherConnect with WebFX to get a digital strategy for your business.Get SEO Proposal",4
